Date,Name,Agency/Position,Location,Description/Cause,Ref.,
"May 28, 2025",Moataz Rajab,Al-Quds TV (editor),Gaza City,Killed in an Israeli airstrike.,[155][156],
"June 5, 2025",Suleiman Hajjaj,Palestine Today (correspondent),"Al-Ahli Arab Hospital, Gaza City","Israeli airstrike, killed alongside two of their relatives.",[157][158][159],
"June 5, 2025",Ismail Badah,Palestine Today (cameraman),,,,
"June 5, 2025",Samir Al-Rifai,Shams News Agency,,,,
"June 5, 2025",Ahmad Qalaja,Al Araby Television Network (cameraman),,,[160],
"June 9, 2025",Moamen Abu Alouf,,Tuffah,Killed by Israeli airstrikes along with three other paramedic workers.,[161][162],
"June 30, 2025",Ismail Abu Hatab,Photojournalist,Gaza City,Killed by an airstrike along with 33 others after Israeli forces targeted a beachside cafe.,[163],
"July 11, 2025",Ahmad Salama Abu Aisha,,"Sawarha, Nuseirat",Killed by an Israeli drone in front of his home.,[164][165],
"July 13, 2025",Hussam Al-Adlouni,,Al-Mawasi,Killed along with his wife and three children after Israeli forces targeted them in a tent.,[166],
"July 13, 2025",Fadi Khalifa,,"Zeitoun, Gaza City",Killed in an Israeli strike while inspecting his home.,,
"July 21, 2025",Tamer Al-Zaanin,Freelance photojournalist,Al-Mawasi,Killed in an Israeli raid.,[167][168],
"July 23, 2025",Walaa Al-Jabari,Editor,Tel al-Hawa,Killed in an Israeli airstrike along with her husband and four of their children. She was also pregnant at the time of her death.,[169],
"August 1, 2025",Marwa Muslim,Unidentified youth radio station,"Shuja'iyya, Gaza City",Killed in an Israeli airstrike along with her two brothers.,[170],
"August 10, 2025",Anas Al-Sharif,Al-Jazeera (correspondent),Al-Shifa Hospital,Killed in an Israeli airstrike targeting Al-Sharif. Two non-journalists were killed as well.,[171],
"August 10, 2025",Mohammed Qreiqeh,Al-Jazeera (correspondent),Al-Shifa Hospital,,,
"August 10, 2025",Ibrahim Zaher,Al-Jazeera (cameraman),Al-Shifa Hospital,,,
"August 10, 2025",Mohammed Noufal,Al-Jazeera (cameraman),Al-Shifa Hospital,,,
"August 10, 2025",Moamen Aliwa,Al-Jazeera (cameraman),Al-Shifa Hospital,,,